[
{"kind": "VAL", "value": "val", "line": 1, "column": 1},
{"kind": "IDENT", "value": "x", "line": 1, "column": 5},
{"kind": "EQ", "value": "=", "line": 1, "column": 7},
{"kind": "INT", "value": "42", "line": 1, "column": 9},
{"kind": "SEMI", "value": ";", "line": 1, "column": 11},
{"kind": "VAR", "value": "var", "line": 2, "column": 1},
{"kind": "IDENT", "value": "y", "line": 2, "column": 5},
{"kind": "EQ", "value": "=", "line": 2, "column": 7},
{"kind": "IDENT", "value": "x", "line": 2, "column": 9},
{"kind": "PLUS", "value": "+", "line": 2, "column": 11},
{"kind": "INT", "value": "1", "line": 2, "column": 13},
{"kind": "SEMI", "value": ";", "line": 2, "column": 14},
{"kind": "RETURN", "value": "return", "line": 3, "column": 1},
{"kind": "IDENT", "value": "y", "line": 3, "column": 8},
{"kind": "SEMI", "value": ";", "line": 3, "column": 9},
{"kind": "EOF", "value": "", "line": 3, "column": 10}
]
