[
{"kind": "VAL", "value": "val", "line": 1, "column": 1},
{"kind": "IDENT", "value": "s", "line": 1, "column": 5},
{"kind": "COLON", "value": ":", "line": 1, "column": 6},
{"kind": "STRING", "value": "String", "line": 1, "column": 8},
{"kind": "EQ", "value": "=", "line": 1, "column": 15},
{"kind": "STR", "value": "hello", "line": 1, "column": 17},
{"kind": "SEMI", "value": ";", "line": 1, "column": 24},
{"kind": "VAL", "value": "val", "line": 2, "column": 1},
{"kind": "IDENT", "value": "msg", "line": 2, "column": 5},
{"kind": "COLON", "value": ":", "line": 2, "column": 8},
{"kind": "STRING", "value": "String", "line": 2, "column": 10},
{"kind": "EQ", "value": "=", "line": 2, "column": 17},
{"kind": "STR", "value": "world", "line": 2, "column": 19},
{"kind": "SEMI", "value": ";", "line": 2, "column": 26},
{"kind": "RETURN", "value": "return", "line": 3, "column": 1},
{"kind": "INT", "value": "0", "line": 3, "column": 8},
{"kind": "SEMI", "value": ";", "line": 3, "column": 9},
{"kind": "EOF", "value": "", "line": 3, "column": 10}
]
