[
{"kind": "RETURN", "value": "return", "line": 1, "column": 1},
{"kind": "INT", "value": "10", "line": 1, "column": 8},
{"kind": "MINUS", "value": "-", "line": 1, "column": 11},
{"kind": "INT", "value": "5", "line": 1, "column": 13},
{"kind": "MINUS", "value": "-", "line": 1, "column": 15},
{"kind": "INT", "value": "2", "line": 1, "column": 17},
{"kind": "SEMI", "value": ";", "line": 1, "column": 18},
{"kind": "EOF", "value": "", "line": 2, "column": 1}
]
