[
{"kind": "DEF", "value": "def", "line": 1, "column": 1},
{"kind": "IDENT", "value": "main", "line": 1, "column": 5},
{"kind": "LPAREN", "value": "(", "line": 1, "column": 9},
{"kind": "RPAREN", "value": ")", "line": 1, "column": 10},
{"kind": "LBRACE", "value": "{", "line": 1, "column": 12},
{"kind": "RETURN", "value": "return", "line": 2, "column": 5},
{"kind": "IDENT", "value": "foo", "line": 2, "column": 12},
{"kind": "LPAREN", "value": "(", "line": 2, "column": 15},
{"kind": "INT", "value": "42", "line": 2, "column": 16},
{"kind": "RPAREN", "value": ")", "line": 2, "column": 18},
{"kind": "SEMI", "value": ";", "line": 2, "column": 19},
{"kind": "RBRACE", "value": "}", "line": 3, "column": 1},
{"kind": "DEF", "value": "def", "line": 5, "column": 1},
{"kind": "IDENT", "value": "foo", "line": 5, "column": 5},
{"kind": "LPAREN", "value": "(", "line": 5, "column": 8},
{"kind": "IDENT", "value": "x", "line": 5, "column": 9},
{"kind": "RPAREN", "value": ")", "line": 5, "column": 10},
{"kind": "LBRACE", "value": "{", "line": 5, "column": 12},
{"kind": "RETURN", "value": "return", "line": 6, "column": 5},
{"kind": "IDENT", "value": "x", "line": 6, "column": 12},
{"kind": "SEMI", "value": ";", "line": 6, "column": 13},
{"kind": "RBRACE", "value": "}", "line": 7, "column": 1},
{"kind": "EOF", "value": "", "line": 8, "column": 1}
]
