[
{"kind": "STRUCT", "value": "struct", "line": 1, "column": 1},
{"kind": "IDENT", "value": "Point", "line": 1, "column": 8},
{"kind": "LBRACE", "value": "{", "line": 1, "column": 14},
{"kind": "IDENT", "value": "x", "line": 2, "column": 5},
{"kind": "COLON", "value": ":", "line": 2, "column": 6},
{"kind": "INT64", "value": "Int64", "line": 2, "column": 8},
{"kind": "SEMI", "value": ";", "line": 2, "column": 13},
{"kind": "IDENT", "value": "y", "line": 3, "column": 5},
{"kind": "COLON", "value": ":", "line": 3, "column": 6},
{"kind": "INT64", "value": "Int64", "line": 3, "column": 8},
{"kind": "SEMI", "value": ";", "line": 3, "column": 13},
{"kind": "RBRACE", "value": "}", "line": 4, "column": 1},
{"kind": "DEF", "value": "def", "line": 5, "column": 1},
{"kind": "IDENT", "value": "makePoint", "line": 5, "column": 5},
{"kind": "LPAREN", "value": "(", "line": 5, "column": 14},
{"kind": "IDENT", "value": "px", "line": 5, "column": 15},
{"kind": "COLON", "value": ":", "line": 5, "column": 17},
{"kind": "INT64", "value": "Int64", "line": 5, "column": 19},
{"kind": "COMMA", "value": ",", "line": 5, "column": 24},
{"kind": "IDENT", "value": "py", "line": 5, "column": 26},
{"kind": "COLON", "value": ":", "line": 5, "column": 28},
{"kind": "INT64", "value": "Int64", "line": 5, "column": 30},
{"kind": "RPAREN", "value": ")", "line": 5, "column": 35},
{"kind": "COLON", "value": ":", "line": 5, "column": 36},
{"kind": "IDENT", "value": "Point", "line": 5, "column": 38},
{"kind": "LBRACE", "value": "{", "line": 5, "column": 44},
{"kind": "VAR", "value": "var", "line": 6, "column": 5},
{"kind": "IDENT", "value": "p", "line": 6, "column": 9},
{"kind": "COLON", "value": ":", "line": 6, "column": 10},
{"kind": "IDENT", "value": "Point", "line": 6, "column": 12},
{"kind": "SEMI", "value": ";", "line": 6, "column": 17},
{"kind": "IDENT", "value": "p", "line": 7, "column": 5},
{"kind": "DOT", "value": ".", "line": 7, "column": 6},
{"kind": "IDENT", "value": "x", "line": 7, "column": 7},
{"kind": "EQ", "value": "=", "line": 7, "column": 9},
{"kind": "IDENT", "value": "px", "line": 7, "column": 11},
{"kind": "SEMI", "value": ";", "line": 7, "column": 13},
{"kind": "IDENT", "value": "p", "line": 8, "column": 5},
{"kind": "DOT", "value": ".", "line": 8, "column": 6},
{"kind": "IDENT", "value": "y", "line": 8, "column": 7},
{"kind": "EQ", "value": "=", "line": 8, "column": 9},
{"kind": "IDENT", "value": "py", "line": 8, "column": 11},
{"kind": "SEMI", "value": ";", "line": 8, "column": 13},
{"kind": "RETURN", "value": "return", "line": 9, "column": 5},
{"kind": "IDENT", "value": "p", "line": 9, "column": 12},
{"kind": "SEMI", "value": ";", "line": 9, "column": 13},
{"kind": "RBRACE", "value": "}", "line": 10, "column": 1},
{"kind": "VAR", "value": "var", "line": 11, "column": 1},
{"kind": "IDENT", "value": "pt", "line": 11, "column": 5},
{"kind": "COLON", "value": ":", "line": 11, "column": 7},
{"kind": "IDENT", "value": "Point", "line": 11, "column": 9},
{"kind": "SEMI", "value": ";", "line": 11, "column": 14},
{"kind": "IDENT", "value": "pt", "line": 12, "column": 1},
{"kind": "EQ", "value": "=", "line": 12, "column": 4},
{"kind": "IDENT", "value": "makePoint", "line": 12, "column": 6},
{"kind": "LPAREN", "value": "(", "line": 12, "column": 15},
{"kind": "INT", "value": "3", "line": 12, "column": 16},
{"kind": "COMMA", "value": ",", "line": 12, "column": 17},
{"kind": "INT", "value": "4", "line": 12, "column": 19},
{"kind": "RPAREN", "value": ")", "line": 12, "column": 20},
{"kind": "SEMI", "value": ";", "line": 12, "column": 21},
{"kind": "VAL", "value": "val", "line": 13, "column": 1},
{"kind": "IDENT", "value": "result", "line": 13, "column": 5},
{"kind": "COLON", "value": ":", "line": 13, "column": 11},
{"kind": "INT64", "value": "Int64", "line": 13, "column": 13},
{"kind": "EQ", "value": "=", "line": 13, "column": 19},
{"kind": "IDENT", "value": "pt", "line": 13, "column": 21},
{"kind": "DOT", "value": ".", "line": 13, "column": 23},
{"kind": "IDENT", "value": "x", "line": 13, "column": 24},
{"kind": "PLUS", "value": "+", "line": 13, "column": 26},
{"kind": "IDENT", "value": "pt", "line": 13, "column": 28},
{"kind": "DOT", "value": ".", "line": 13, "column": 30},
{"kind": "IDENT", "value": "y", "line": 13, "column": 31},
{"kind": "SEMI", "value": ";", "line": 13, "column": 32},
{"kind": "RETURN", "value": "return", "line": 14, "column": 1},
{"kind": "IDENT", "value": "result", "line": 14, "column": 8},
{"kind": "SEMI", "value": ";", "line": 14, "column": 14},
{"kind": "EOF", "value": "", "line": 14, "column": 15}
]
