[
{"kind": "DEF", "value": "def", "line": 1, "column": 1},
{"kind": "IDENT", "value": "foo", "line": 1, "column": 5},
{"kind": "LPAREN", "value": "(", "line": 1, "column": 8},
{"kind": "RPAREN", "value": ")", "line": 1, "column": 9},
{"kind": "LBRACE", "value": "{", "line": 1, "column": 11},
{"kind": "RBRACE", "value": "}", "line": 1, "column": 12},
{"kind": "EOF", "value": "", "line": 2, "column": 1}
]
