[
{"kind": "VAR", "value": "var", "line": 1, "column": 1},
{"kind": "IDENT", "value": "x", "line": 1, "column": 5},
{"kind": "COLON", "value": ":", "line": 1, "column": 6},
{"kind": "BOOL", "value": "Bool", "line": 1, "column": 8},
{"kind": "EQ", "value": "=", "line": 1, "column": 13},
{"kind": "TRUE", "value": "true", "line": 1, "column": 15},
{"kind": "SEMI", "value": ";", "line": 1, "column": 19},
{"kind": "VAR", "value": "var", "line": 2, "column": 1},
{"kind": "IDENT", "value": "y", "line": 2, "column": 5},
{"kind": "COLON", "value": ":", "line": 2, "column": 6},
{"kind": "INT64", "value": "Int64", "line": 2, "column": 8},
{"kind": "EQ", "value": "=", "line": 2, "column": 14},
{"kind": "CAST", "value": "cast", "line": 2, "column": 16},
{"kind": "LT", "value": "<", "line": 2, "column": 20},
{"kind": "INT64", "value": "Int64", "line": 2, "column": 21},
{"kind": "GT", "value": ">", "line": 2, "column": 26},
{"kind": "LPAREN", "value": "(", "line": 2, "column": 27},
{"kind": "IDENT", "value": "x", "line": 2, "column": 28},
{"kind": "RPAREN", "value": ")", "line": 2, "column": 29},
{"kind": "SEMI", "value": ";", "line": 2, "column": 30},
{"kind": "RETURN", "value": "return", "line": 3, "column": 1},
{"kind": "IDENT", "value": "y", "line": 3, "column": 8},
{"kind": "SEMI", "value": ";", "line": 3, "column": 9},
{"kind": "EOF", "value": "", "line": 4, "column": 1}
]
