[
{"kind": "EXTERN", "value": "extern", "line": 1, "column": 1},
{"kind": "DEF", "value": "def", "line": 1, "column": 8},
{"kind": "IDENT", "value": "foo", "line": 1, "column": 12},
{"kind": "LPAREN", "value": "(", "line": 1, "column": 15},
{"kind": "RPAREN", "value": ")", "line": 1, "column": 16},
{"kind": "SEMI", "value": ";", "line": 1, "column": 17},
{"kind": "EOF", "value": "", "line": 2, "column": 1}
]
