[
{"kind": "EXTERN", "value": "extern", "line": 1, "column": 1},
{"kind": "DEF", "value": "def", "line": 1, "column": 8},
{"kind": "IDENT", "value": "putchar", "line": 1, "column": 12},
{"kind": "LPAREN", "value": "(", "line": 1, "column": 19},
{"kind": "IDENT", "value": "c", "line": 1, "column": 20},
{"kind": "COLON", "value": ":", "line": 1, "column": 21},
{"kind": "INT8", "value": "Int8", "line": 1, "column": 23},
{"kind": "RPAREN", "value": ")", "line": 1, "column": 27},
{"kind": "COLON", "value": ":", "line": 1, "column": 28},
{"kind": "INT64", "value": "Int64", "line": 1, "column": 30},
{"kind": "SEMI", "value": ";", "line": 1, "column": 35},
{"kind": "EXTERN", "value": "extern", "line": 2, "column": 1},
{"kind": "DEF", "value": "def", "line": 2, "column": 8},
{"kind": "IDENT", "value": "exit", "line": 2, "column": 12},
{"kind": "LPAREN", "value": "(", "line": 2, "column": 16},
{"kind": "IDENT", "value": "code", "line": 2, "column": 17},
{"kind": "COLON", "value": ":", "line": 2, "column": 21},
{"kind": "INT64", "value": "Int64", "line": 2, "column": 23},
{"kind": "RPAREN", "value": ")", "line": 2, "column": 28},
{"kind": "COLON", "value": ":", "line": 2, "column": 29},
{"kind": "INT64", "value": "Int64", "line": 2, "column": 31},
{"kind": "SEMI", "value": ";", "line": 2, "column": 36},
{"kind": "VAL", "value": "val", "line": 3, "column": 1},
{"kind": "IDENT", "value": "r", "line": 3, "column": 5},
{"kind": "COLON", "value": ":", "line": 3, "column": 6},
{"kind": "INT64", "value": "Int64", "line": 3, "column": 8},
{"kind": "EQ", "value": "=", "line": 3, "column": 14},
{"kind": "IDENT", "value": "putchar", "line": 3, "column": 16},
{"kind": "LPAREN", "value": "(", "line": 3, "column": 23},
{"kind": "CAST", "value": "cast", "line": 3, "column": 24},
{"kind": "LT", "value": "<", "line": 3, "column": 28},
{"kind": "INT8", "value": "Int8", "line": 3, "column": 29},
{"kind": "GT", "value": ">", "line": 3, "column": 33},
{"kind": "LPAREN", "value": "(", "line": 3, "column": 34},
{"kind": "INT", "value": "65", "line": 3, "column": 35},
{"kind": "RPAREN", "value": ")", "line": 3, "column": 37},
{"kind": "RPAREN", "value": ")", "line": 3, "column": 38},
{"kind": "SEMI", "value": ";", "line": 3, "column": 39},
{"kind": "VAR", "value": "var", "line": 4, "column": 1},
{"kind": "IDENT", "value": "code", "line": 4, "column": 5},
{"kind": "COLON", "value": ":", "line": 4, "column": 9},
{"kind": "INT64", "value": "Int64", "line": 4, "column": 11},
{"kind": "EQ", "value": "=", "line": 4, "column": 17},
{"kind": "INT", "value": "0", "line": 4, "column": 19},
{"kind": "SEMI", "value": ";", "line": 4, "column": 20},
{"kind": "RETURN", "value": "return", "line": 5, "column": 1},
{"kind": "IDENT", "value": "code", "line": 5, "column": 8},
{"kind": "SEMI", "value": ";", "line": 5, "column": 12},
{"kind": "EOF", "value": "", "line": 5, "column": 13}
]
