[
{"kind": "VAR", "value": "var", "line": 1, "column": 1},
{"kind": "IDENT", "value": "i", "line": 1, "column": 5},
{"kind": "EQ", "value": "=", "line": 1, "column": 7},
{"kind": "INT", "value": "0", "line": 1, "column": 9},
{"kind": "SEMI", "value": ";", "line": 1, "column": 10},
{"kind": "WHILE", "value": "while", "line": 2, "column": 1},
{"kind": "LPAREN", "value": "(", "line": 2, "column": 7},
{"kind": "IDENT", "value": "i", "line": 2, "column": 8},
{"kind": "LT", "value": "<", "line": 2, "column": 10},
{"kind": "INT", "value": "10", "line": 2, "column": 12},
{"kind": "RPAREN", "value": ")", "line": 2, "column": 14},
{"kind": "LBRACE", "value": "{", "line": 2, "column": 16},
{"kind": "IF", "value": "if", "line": 3, "column": 5},
{"kind": "LPAREN", "value": "(", "line": 3, "column": 8},
{"kind": "IDENT", "value": "i", "line": 3, "column": 9},
{"kind": "EQEQ", "value": "==", "line": 3, "column": 11},
{"kind": "INT", "value": "5", "line": 3, "column": 14},
{"kind": "RPAREN", "value": ")", "line": 3, "column": 15},
{"kind": "LBRACE", "value": "{", "line": 3, "column": 17},
{"kind": "BREAK", "value": "break", "line": 4, "column": 9},
{"kind": "SEMI", "value": ";", "line": 4, "column": 14},
{"kind": "RBRACE", "value": "}", "line": 5, "column": 5},
{"kind": "IDENT", "value": "i", "line": 6, "column": 5},
{"kind": "EQ", "value": "=", "line": 6, "column": 7},
{"kind": "IDENT", "value": "i", "line": 6, "column": 9},
{"kind": "PLUS", "value": "+", "line": 6, "column": 11},
{"kind": "INT", "value": "1", "line": 6, "column": 13},
{"kind": "SEMI", "value": ";", "line": 6, "column": 14},
{"kind": "RBRACE", "value": "}", "line": 7, "column": 1},
{"kind": "EOF", "value": "", "line": 7, "column": 2}
]
