[
{"kind": "STRUCT", "value": "struct", "line": 1, "column": 1},
{"kind": "IDENT", "value": "Rectangle", "line": 1, "column": 8},
{"kind": "LBRACE", "value": "{", "line": 1, "column": 18},
{"kind": "IDENT", "value": "width", "line": 2, "column": 3},
{"kind": "COLON", "value": ":", "line": 2, "column": 8},
{"kind": "INT64", "value": "Int64", "line": 2, "column": 10},
{"kind": "SEMI", "value": ";", "line": 2, "column": 15},
{"kind": "IDENT", "value": "height", "line": 3, "column": 3},
{"kind": "COLON", "value": ":", "line": 3, "column": 9},
{"kind": "INT64", "value": "Int64", "line": 3, "column": 11},
{"kind": "SEMI", "value": ";", "line": 3, "column": 16},
{"kind": "RBRACE", "value": "}", "line": 4, "column": 1},
{"kind": "VAR", "value": "var", "line": 6, "column": 1},
{"kind": "IDENT", "value": "r", "line": 6, "column": 5},
{"kind": "COLON", "value": ":", "line": 6, "column": 6},
{"kind": "IDENT", "value": "Rectangle", "line": 6, "column": 8},
{"kind": "SEMI", "value": ";", "line": 6, "column": 17},
{"kind": "IDENT", "value": "r", "line": 7, "column": 1},
{"kind": "DOT", "value": ".", "line": 7, "column": 2},
{"kind": "IDENT", "value": "width", "line": 7, "column": 3},
{"kind": "EQ", "value": "=", "line": 7, "column": 9},
{"kind": "INT", "value": "6", "line": 7, "column": 11},
{"kind": "SEMI", "value": ";", "line": 7, "column": 12},
{"kind": "IDENT", "value": "r", "line": 8, "column": 1},
{"kind": "DOT", "value": ".", "line": 8, "column": 2},
{"kind": "IDENT", "value": "height", "line": 8, "column": 3},
{"kind": "EQ", "value": "=", "line": 8, "column": 10},
{"kind": "INT", "value": "7", "line": 8, "column": 12},
{"kind": "SEMI", "value": ";", "line": 8, "column": 13},
{"kind": "VAR", "value": "var", "line": 9, "column": 1},
{"kind": "IDENT", "value": "area", "line": 9, "column": 5},
{"kind": "COLON", "value": ":", "line": 9, "column": 9},
{"kind": "INT64", "value": "Int64", "line": 9, "column": 11},
{"kind": "SEMI", "value": ";", "line": 9, "column": 16},
{"kind": "IDENT", "value": "area", "line": 10, "column": 1},
{"kind": "EQ", "value": "=", "line": 10, "column": 6},
{"kind": "IDENT", "value": "r", "line": 10, "column": 8},
{"kind": "DOT", "value": ".", "line": 10, "column": 9},
{"kind": "IDENT", "value": "width", "line": 10, "column": 10},
{"kind": "MULT", "value": "*", "line": 10, "column": 16},
{"kind": "IDENT", "value": "r", "line": 10, "column": 18},
{"kind": "DOT", "value": ".", "line": 10, "column": 19},
{"kind": "IDENT", "value": "height", "line": 10, "column": 20},
{"kind": "SEMI", "value": ";", "line": 10, "column": 26},
{"kind": "RETURN", "value": "return", "line": 11, "column": 1},
{"kind": "IDENT", "value": "area", "line": 11, "column": 8},
{"kind": "SEMI", "value": ";", "line": 11, "column": 12},
{"kind": "EOF", "value": "", "line": 12, "column": 1}
]
