[
{"kind": "EXTERN", "value": "extern", "line": 1, "column": 1},
{"kind": "DEF", "value": "def", "line": 1, "column": 8},
{"kind": "IDENT", "value": "foo", "line": 1, "column": 12},
{"kind": "LPAREN", "value": "(", "line": 1, "column": 15},
{"kind": "IDENT", "value": "x", "line": 1, "column": 16},
{"kind": "RPAREN", "value": ")", "line": 1, "column": 17},
{"kind": "SEMI", "value": ";", "line": 1, "column": 18},
{"kind": "EXTERN", "value": "extern", "line": 2, "column": 1},
{"kind": "DEF", "value": "def", "line": 2, "column": 8},
{"kind": "IDENT", "value": "bar", "line": 2, "column": 12},
{"kind": "LPAREN", "value": "(", "line": 2, "column": 15},
{"kind": "IDENT", "value": "y", "line": 2, "column": 16},
{"kind": "COMMA", "value": ",", "line": 2, "column": 17},
{"kind": "IDENT", "value": "z", "line": 2, "column": 19},
{"kind": "RPAREN", "value": ")", "line": 2, "column": 20},
{"kind": "SEMI", "value": ";", "line": 2, "column": 21},
{"kind": "EOF", "value": "", "line": 3, "column": 1}
]
