[
{"kind": "IDENT", "value": "x", "line": 1, "column": 1},
{"kind": "EQ", "value": "=", "line": 1, "column": 3},
{"kind": "INT", "value": "42", "line": 1, "column": 5},
{"kind": "SEMI", "value": ";", "line": 1, "column": 7},
{"kind": "RETURN", "value": "return", "line": 2, "column": 1},
{"kind": "IDENT", "value": "x", "line": 2, "column": 8},
{"kind": "SEMI", "value": ";", "line": 2, "column": 9},
{"kind": "EOF", "value": "", "line": 2, "column": 10}
]
