[
{"kind": "VAR", "value": "var", "line": 1, "column": 1},
{"kind": "IDENT", "value": "result", "line": 1, "column": 5},
{"kind": "EQ", "value": "=", "line": 1, "column": 12},
{"kind": "LPAREN", "value": "(", "line": 1, "column": 14},
{"kind": "INT", "value": "1", "line": 1, "column": 15},
{"kind": "PLUS", "value": "+", "line": 1, "column": 17},
{"kind": "INT", "value": "2", "line": 1, "column": 19},
{"kind": "RPAREN", "value": ")", "line": 1, "column": 20},
{"kind": "MULT", "value": "*", "line": 1, "column": 22},
{"kind": "LPAREN", "value": "(", "line": 1, "column": 24},
{"kind": "INT", "value": "3", "line": 1, "column": 25},
{"kind": "MINUS", "value": "-", "line": 1, "column": 27},
{"kind": "INT", "value": "4", "line": 1, "column": 29},
{"kind": "RPAREN", "value": ")", "line": 1, "column": 30},
{"kind": "DIV", "value": "/", "line": 1, "column": 32},
{"kind": "INT", "value": "5", "line": 1, "column": 34},
{"kind": "SEMI", "value": ";", "line": 1, "column": 35},
{"kind": "EOF", "value": "", "line": 1, "column": 36}
]
