[
{"kind": "VAR", "value": "var", "line": 1, "column": 1},
{"kind": "IDENT", "value": "arr", "line": 1, "column": 5},
{"kind": "COLON", "value": ":", "line": 1, "column": 8},
{"kind": "INT64", "value": "Int64", "line": 1, "column": 10},
{"kind": "LBRACKET", "value": "[", "line": 1, "column": 15},
{"kind": "INT", "value": "5", "line": 1, "column": 16},
{"kind": "RBRACKET", "value": "]", "line": 1, "column": 17},
{"kind": "SEMI", "value": ";", "line": 1, "column": 18},
{"kind": "VAR", "value": "var", "line": 2, "column": 1},
{"kind": "IDENT", "value": "i", "line": 2, "column": 5},
{"kind": "COLON", "value": ":", "line": 2, "column": 6},
{"kind": "INT64", "value": "Int64", "line": 2, "column": 8},
{"kind": "SEMI", "value": ";", "line": 2, "column": 13},
{"kind": "IDENT", "value": "i", "line": 3, "column": 1},
{"kind": "EQ", "value": "=", "line": 3, "column": 3},
{"kind": "INT", "value": "0", "line": 3, "column": 5},
{"kind": "SEMI", "value": ";", "line": 3, "column": 6},
{"kind": "IDENT", "value": "arr", "line": 4, "column": 1},
{"kind": "LBRACKET", "value": "[", "line": 4, "column": 4},
{"kind": "INT", "value": "0", "line": 4, "column": 5},
{"kind": "RBRACKET", "value": "]", "line": 4, "column": 6},
{"kind": "EQ", "value": "=", "line": 4, "column": 8},
{"kind": "INT", "value": "10", "line": 4, "column": 10},
{"kind": "SEMI", "value": ";", "line": 4, "column": 12},
{"kind": "IDENT", "value": "arr", "line": 5, "column": 1},
{"kind": "LBRACKET", "value": "[", "line": 5, "column": 4},
{"kind": "INT", "value": "1", "line": 5, "column": 5},
{"kind": "RBRACKET", "value": "]", "line": 5, "column": 6},
{"kind": "EQ", "value": "=", "line": 5, "column": 8},
{"kind": "INT", "value": "20", "line": 5, "column": 10},
{"kind": "SEMI", "value": ";", "line": 5, "column": 12},
{"kind": "IDENT", "value": "arr", "line": 6, "column": 1},
{"kind": "LBRACKET", "value": "[", "line": 6, "column": 4},
{"kind": "INT", "value": "2", "line": 6, "column": 5},
{"kind": "RBRACKET", "value": "]", "line": 6, "column": 6},
{"kind": "EQ", "value": "=", "line": 6, "column": 8},
{"kind": "INT", "value": "30", "line": 6, "column": 10},
{"kind": "SEMI", "value": ";", "line": 6, "column": 12},
{"kind": "IDENT", "value": "arr", "line": 7, "column": 1},
{"kind": "LBRACKET", "value": "[", "line": 7, "column": 4},
{"kind": "INT", "value": "3", "line": 7, "column": 5},
{"kind": "RBRACKET", "value": "]", "line": 7, "column": 6},
{"kind": "EQ", "value": "=", "line": 7, "column": 8},
{"kind": "INT", "value": "40", "line": 7, "column": 10},
{"kind": "SEMI", "value": ";", "line": 7, "column": 12},
{"kind": "IDENT", "value": "arr", "line": 8, "column": 1},
{"kind": "LBRACKET", "value": "[", "line": 8, "column": 4},
{"kind": "INT", "value": "4", "line": 8, "column": 5},
{"kind": "RBRACKET", "value": "]", "line": 8, "column": 6},
{"kind": "EQ", "value": "=", "line": 8, "column": 8},
{"kind": "INT", "value": "50", "line": 8, "column": 10},
{"kind": "SEMI", "value": ";", "line": 8, "column": 12},
{"kind": "VAL", "value": "val", "line": 9, "column": 1},
{"kind": "IDENT", "value": "result", "line": 9, "column": 5},
{"kind": "COLON", "value": ":", "line": 9, "column": 11},
{"kind": "INT64", "value": "Int64", "line": 9, "column": 13},
{"kind": "EQ", "value": "=", "line": 9, "column": 19},
{"kind": "IDENT", "value": "arr", "line": 9, "column": 21},
{"kind": "LBRACKET", "value": "[", "line": 9, "column": 24},
{"kind": "INT", "value": "2", "line": 9, "column": 25},
{"kind": "RBRACKET", "value": "]", "line": 9, "column": 26},
{"kind": "SEMI", "value": ";", "line": 9, "column": 27},
{"kind": "RETURN", "value": "return", "line": 10, "column": 1},
{"kind": "IDENT", "value": "result", "line": 10, "column": 8},
{"kind": "SEMI", "value": ";", "line": 10, "column": 14},
{"kind": "EOF", "value": "", "line": 10, "column": 15}
]
