[
{"kind": "DEF", "value": "def", "line": 1, "column": 1},
{"kind": "IDENT", "value": "fact", "line": 1, "column": 5},
{"kind": "LPAREN", "value": "(", "line": 1, "column": 9},
{"kind": "IDENT", "value": "n", "line": 1, "column": 10},
{"kind": "RPAREN", "value": ")", "line": 1, "column": 11},
{"kind": "LBRACE", "value": "{", "line": 1, "column": 13},
{"kind": "IF", "value": "if", "line": 2, "column": 5},
{"kind": "LPAREN", "value": "(", "line": 2, "column": 8},
{"kind": "IDENT", "value": "n", "line": 2, "column": 9},
{"kind": "LE", "value": "<=", "line": 2, "column": 11},
{"kind": "INT", "value": "1", "line": 2, "column": 14},
{"kind": "RPAREN", "value": ")", "line": 2, "column": 15},
{"kind": "LBRACE", "value": "{", "line": 2, "column": 17},
{"kind": "RETURN", "value": "return", "line": 3, "column": 9},
{"kind": "INT", "value": "1", "line": 3, "column": 16},
{"kind": "SEMI", "value": ";", "line": 3, "column": 17},
{"kind": "RBRACE", "value": "}", "line": 4, "column": 5},
{"kind": "RETURN", "value": "return", "line": 5, "column": 5},
{"kind": "IDENT", "value": "n", "line": 5, "column": 12},
{"kind": "MULT", "value": "*", "line": 5, "column": 14},
{"kind": "IDENT", "value": "fact", "line": 5, "column": 16},
{"kind": "LPAREN", "value": "(", "line": 5, "column": 20},
{"kind": "IDENT", "value": "n", "line": 5, "column": 21},
{"kind": "MINUS", "value": "-", "line": 5, "column": 23},
{"kind": "INT", "value": "1", "line": 5, "column": 25},
{"kind": "RPAREN", "value": ")", "line": 5, "column": 26},
{"kind": "SEMI", "value": ";", "line": 5, "column": 27},
{"kind": "RBRACE", "value": "}", "line": 6, "column": 1},
{"kind": "EOF", "value": "", "line": 7, "column": 1}
]
