[
{"kind": "VAR", "value": "var", "line": 1, "column": 1},
{"kind": "IDENT", "value": "x", "line": 1, "column": 5},
{"kind": "EQ", "value": "=", "line": 1, "column": 7},
{"kind": "NOT", "value": "!", "line": 1, "column": 9},
{"kind": "TRUE", "value": "true", "line": 1, "column": 10},
{"kind": "SEMI", "value": ";", "line": 1, "column": 14},
{"kind": "EOF", "value": "", "line": 2, "column": 1}
]
