[
{"kind": "DEF", "value": "def", "line": 1, "column": 1},
{"kind": "IDENT", "value": "add", "line": 1, "column": 5},
{"kind": "LPAREN", "value": "(", "line": 1, "column": 8},
{"kind": "IDENT", "value": "a", "line": 1, "column": 9},
{"kind": "COMMA", "value": ",", "line": 1, "column": 10},
{"kind": "IDENT", "value": "b", "line": 1, "column": 12},
{"kind": "RPAREN", "value": ")", "line": 1, "column": 13},
{"kind": "LBRACE", "value": "{", "line": 1, "column": 15},
{"kind": "RETURN", "value": "return", "line": 2, "column": 5},
{"kind": "IDENT", "value": "a", "line": 2, "column": 12},
{"kind": "PLUS", "value": "+", "line": 2, "column": 14},
{"kind": "IDENT", "value": "b", "line": 2, "column": 16},
{"kind": "SEMI", "value": ";", "line": 2, "column": 17},
{"kind": "RBRACE", "value": "}", "line": 3, "column": 1},
{"kind": "DEF", "value": "def", "line": 5, "column": 1},
{"kind": "IDENT", "value": "main", "line": 5, "column": 5},
{"kind": "LPAREN", "value": "(", "line": 5, "column": 9},
{"kind": "RPAREN", "value": ")", "line": 5, "column": 10},
{"kind": "LBRACE", "value": "{", "line": 5, "column": 12},
{"kind": "VAR", "value": "var", "line": 6, "column": 5},
{"kind": "IDENT", "value": "x", "line": 6, "column": 9},
{"kind": "EQ", "value": "=", "line": 6, "column": 11},
{"kind": "IDENT", "value": "add", "line": 6, "column": 13},
{"kind": "LPAREN", "value": "(", "line": 6, "column": 16},
{"kind": "IDENT", "value": "add", "line": 6, "column": 17},
{"kind": "LPAREN", "value": "(", "line": 6, "column": 20},
{"kind": "INT", "value": "1", "line": 6, "column": 21},
{"kind": "COMMA", "value": ",", "line": 6, "column": 22},
{"kind": "INT", "value": "2", "line": 6, "column": 24},
{"kind": "RPAREN", "value": ")", "line": 6, "column": 25},
{"kind": "COMMA", "value": ",", "line": 6, "column": 26},
{"kind": "IDENT", "value": "add", "line": 6, "column": 28},
{"kind": "LPAREN", "value": "(", "line": 6, "column": 31},
{"kind": "INT", "value": "3", "line": 6, "column": 32},
{"kind": "COMMA", "value": ",", "line": 6, "column": 33},
{"kind": "INT", "value": "4", "line": 6, "column": 35},
{"kind": "RPAREN", "value": ")", "line": 6, "column": 36},
{"kind": "RPAREN", "value": ")", "line": 6, "column": 37},
{"kind": "SEMI", "value": ";", "line": 6, "column": 38},
{"kind": "RETURN", "value": "return", "line": 7, "column": 5},
{"kind": "IDENT", "value": "x", "line": 7, "column": 12},
{"kind": "SEMI", "value": ";", "line": 7, "column": 13},
{"kind": "RBRACE", "value": "}", "line": 8, "column": 1},
{"kind": "EOF", "value": "", "line": 8, "column": 2}
]
