[
{"kind": "VAR", "value": "var", "line": 1, "column": 1},
{"kind": "IDENT", "value": "x", "line": 1, "column": 5},
{"kind": "EQ", "value": "=", "line": 1, "column": 7},
{"kind": "INT", "value": "1", "line": 1, "column": 9},
{"kind": "SEMI", "value": ";", "line": 1, "column": 10},
{"kind": "WHILE", "value": "while", "line": 2, "column": 1},
{"kind": "LPAREN", "value": "(", "line": 2, "column": 7},
{"kind": "IDENT", "value": "x", "line": 2, "column": 8},
{"kind": "RPAREN", "value": ")", "line": 2, "column": 9},
{"kind": "IDENT", "value": "x", "line": 3, "column": 5},
{"kind": "EQ", "value": "=", "line": 3, "column": 7},
{"kind": "IDENT", "value": "x", "line": 3, "column": 9},
{"kind": "MINUS", "value": "-", "line": 3, "column": 11},
{"kind": "INT", "value": "1", "line": 3, "column": 13},
{"kind": "SEMI", "value": ";", "line": 3, "column": 14},
{"kind": "EOF", "value": "", "line": 3, "column": 15}
]
