[
{"kind": "STRUCT", "value": "struct", "line": 1, "column": 1},
{"kind": "IDENT", "value": "Inner", "line": 1, "column": 8},
{"kind": "LBRACE", "value": "{", "line": 1, "column": 14},
{"kind": "IDENT", "value": "value", "line": 2, "column": 5},
{"kind": "COLON", "value": ":", "line": 2, "column": 10},
{"kind": "INT64", "value": "Int64", "line": 2, "column": 12},
{"kind": "SEMI", "value": ";", "line": 2, "column": 17},
{"kind": "RBRACE", "value": "}", "line": 3, "column": 1},
{"kind": "STRUCT", "value": "struct", "line": 4, "column": 1},
{"kind": "IDENT", "value": "Outer", "line": 4, "column": 8},
{"kind": "LBRACE", "value": "{", "line": 4, "column": 14},
{"kind": "IDENT", "value": "inner", "line": 5, "column": 5},
{"kind": "COLON", "value": ":", "line": 5, "column": 10},
{"kind": "IDENT", "value": "Inner", "line": 5, "column": 12},
{"kind": "SEMI", "value": ";", "line": 5, "column": 17},
{"kind": "IDENT", "value": "extra", "line": 6, "column": 5},
{"kind": "COLON", "value": ":", "line": 6, "column": 10},
{"kind": "INT64", "value": "Int64", "line": 6, "column": 12},
{"kind": "SEMI", "value": ";", "line": 6, "column": 17},
{"kind": "RBRACE", "value": "}", "line": 7, "column": 1},
{"kind": "VAR", "value": "var", "line": 8, "column": 1},
{"kind": "IDENT", "value": "o", "line": 8, "column": 5},
{"kind": "COLON", "value": ":", "line": 8, "column": 6},
{"kind": "IDENT", "value": "Outer", "line": 8, "column": 8},
{"kind": "SEMI", "value": ";", "line": 8, "column": 13},
{"kind": "IDENT", "value": "o", "line": 9, "column": 1},
{"kind": "DOT", "value": ".", "line": 9, "column": 2},
{"kind": "IDENT", "value": "inner", "line": 9, "column": 3},
{"kind": "DOT", "value": ".", "line": 9, "column": 8},
{"kind": "IDENT", "value": "value", "line": 9, "column": 9},
{"kind": "EQ", "value": "=", "line": 9, "column": 15},
{"kind": "INT", "value": "42", "line": 9, "column": 17},
{"kind": "SEMI", "value": ";", "line": 9, "column": 19},
{"kind": "IDENT", "value": "o", "line": 10, "column": 1},
{"kind": "DOT", "value": ".", "line": 10, "column": 2},
{"kind": "IDENT", "value": "extra", "line": 10, "column": 3},
{"kind": "EQ", "value": "=", "line": 10, "column": 9},
{"kind": "INT", "value": "7", "line": 10, "column": 11},
{"kind": "SEMI", "value": ";", "line": 10, "column": 12},
{"kind": "RETURN", "value": "return", "line": 11, "column": 1},
{"kind": "IDENT", "value": "o", "line": 11, "column": 8},
{"kind": "DOT", "value": ".", "line": 11, "column": 9},
{"kind": "IDENT", "value": "inner", "line": 11, "column": 10},
{"kind": "DOT", "value": ".", "line": 11, "column": 15},
{"kind": "IDENT", "value": "value", "line": 11, "column": 16},
{"kind": "PLUS", "value": "+", "line": 11, "column": 22},
{"kind": "IDENT", "value": "o", "line": 11, "column": 24},
{"kind": "DOT", "value": ".", "line": 11, "column": 25},
{"kind": "IDENT", "value": "extra", "line": 11, "column": 26},
{"kind": "SEMI", "value": ";", "line": 11, "column": 31},
{"kind": "EOF", "value": "", "line": 11, "column": 32}
]
