[
{"kind": "DEF", "value": "def", "line": 1, "column": 1},
{"kind": "IDENT", "value": "noop", "line": 1, "column": 5},
{"kind": "LPAREN", "value": "(", "line": 1, "column": 9},
{"kind": "RPAREN", "value": ")", "line": 1, "column": 10},
{"kind": "LBRACE", "value": "{", "line": 1, "column": 12},
{"kind": "VAR", "value": "var", "line": 2, "column": 3},
{"kind": "IDENT", "value": "x", "line": 2, "column": 7},
{"kind": "EQ", "value": "=", "line": 2, "column": 9},
{"kind": "INT", "value": "0", "line": 2, "column": 11},
{"kind": "SEMI", "value": ";", "line": 2, "column": 12},
{"kind": "RBRACE", "value": "}", "line": 3, "column": 1},
{"kind": "RETURN", "value": "return", "line": 4, "column": 1},
{"kind": "INT", "value": "42", "line": 4, "column": 8},
{"kind": "SEMI", "value": ";", "line": 4, "column": 10},
{"kind": "EOF", "value": "", "line": 5, "column": 1}
]
