[
{"kind": "STRUCT", "value": "struct", "line": 1, "column": 1},
{"kind": "IDENT", "value": "Pair", "line": 1, "column": 8},
{"kind": "LBRACE", "value": "{", "line": 1, "column": 13},
{"kind": "IDENT", "value": "first", "line": 2, "column": 5},
{"kind": "COLON", "value": ":", "line": 2, "column": 10},
{"kind": "INT64", "value": "Int64", "line": 2, "column": 12},
{"kind": "SEMI", "value": ";", "line": 2, "column": 17},
{"kind": "IDENT", "value": "second", "line": 3, "column": 5},
{"kind": "COLON", "value": ":", "line": 3, "column": 11},
{"kind": "INT64", "value": "Int64", "line": 3, "column": 13},
{"kind": "SEMI", "value": ";", "line": 3, "column": 18},
{"kind": "RBRACE", "value": "}", "line": 4, "column": 1},
{"kind": "VAR", "value": "var", "line": 5, "column": 1},
{"kind": "IDENT", "value": "p", "line": 5, "column": 5},
{"kind": "COLON", "value": ":", "line": 5, "column": 6},
{"kind": "IDENT", "value": "Pair", "line": 5, "column": 8},
{"kind": "SEMI", "value": ";", "line": 5, "column": 12},
{"kind": "VAR", "value": "var", "line": 6, "column": 1},
{"kind": "IDENT", "value": "arr", "line": 6, "column": 5},
{"kind": "COLON", "value": ":", "line": 6, "column": 8},
{"kind": "INT64", "value": "Int64", "line": 6, "column": 10},
{"kind": "LBRACKET", "value": "[", "line": 6, "column": 15},
{"kind": "INT", "value": "4", "line": 6, "column": 16},
{"kind": "RBRACKET", "value": "]", "line": 6, "column": 17},
{"kind": "SEMI", "value": ";", "line": 6, "column": 18},
{"kind": "IDENT", "value": "p", "line": 7, "column": 1},
{"kind": "DOT", "value": ".", "line": 7, "column": 2},
{"kind": "IDENT", "value": "first", "line": 7, "column": 3},
{"kind": "EQ", "value": "=", "line": 7, "column": 9},
{"kind": "INT", "value": "10", "line": 7, "column": 11},
{"kind": "SEMI", "value": ";", "line": 7, "column": 13},
{"kind": "IDENT", "value": "p", "line": 8, "column": 1},
{"kind": "DOT", "value": ".", "line": 8, "column": 2},
{"kind": "IDENT", "value": "second", "line": 8, "column": 3},
{"kind": "EQ", "value": "=", "line": 8, "column": 10},
{"kind": "INT", "value": "20", "line": 8, "column": 12},
{"kind": "SEMI", "value": ";", "line": 8, "column": 14},
{"kind": "IDENT", "value": "arr", "line": 9, "column": 1},
{"kind": "LBRACKET", "value": "[", "line": 9, "column": 4},
{"kind": "INT", "value": "0", "line": 9, "column": 5},
{"kind": "RBRACKET", "value": "]", "line": 9, "column": 6},
{"kind": "EQ", "value": "=", "line": 9, "column": 8},
{"kind": "IDENT", "value": "p", "line": 9, "column": 10},
{"kind": "DOT", "value": ".", "line": 9, "column": 11},
{"kind": "IDENT", "value": "first", "line": 9, "column": 12},
{"kind": "SEMI", "value": ";", "line": 9, "column": 17},
{"kind": "IDENT", "value": "arr", "line": 10, "column": 1},
{"kind": "LBRACKET", "value": "[", "line": 10, "column": 4},
{"kind": "INT", "value": "1", "line": 10, "column": 5},
{"kind": "RBRACKET", "value": "]", "line": 10, "column": 6},
{"kind": "EQ", "value": "=", "line": 10, "column": 8},
{"kind": "IDENT", "value": "p", "line": 10, "column": 10},
{"kind": "DOT", "value": ".", "line": 10, "column": 11},
{"kind": "IDENT", "value": "second", "line": 10, "column": 12},
{"kind": "SEMI", "value": ";", "line": 10, "column": 18},
{"kind": "IDENT", "value": "p", "line": 11, "column": 1},
{"kind": "DOT", "value": ".", "line": 11, "column": 2},
{"kind": "IDENT", "value": "first", "line": 11, "column": 3},
{"kind": "EQ", "value": "=", "line": 11, "column": 9},
{"kind": "IDENT", "value": "arr", "line": 11, "column": 11},
{"kind": "LBRACKET", "value": "[", "line": 11, "column": 14},
{"kind": "INT", "value": "0", "line": 11, "column": 15},
{"kind": "RBRACKET", "value": "]", "line": 11, "column": 16},
{"kind": "PLUS", "value": "+", "line": 11, "column": 18},
{"kind": "IDENT", "value": "arr", "line": 11, "column": 20},
{"kind": "LBRACKET", "value": "[", "line": 11, "column": 23},
{"kind": "INT", "value": "1", "line": 11, "column": 24},
{"kind": "RBRACKET", "value": "]", "line": 11, "column": 25},
{"kind": "SEMI", "value": ";", "line": 11, "column": 26},
{"kind": "RETURN", "value": "return", "line": 12, "column": 1},
{"kind": "IDENT", "value": "p", "line": 12, "column": 8},
{"kind": "DOT", "value": ".", "line": 12, "column": 9},
{"kind": "IDENT", "value": "first", "line": 12, "column": 10},
{"kind": "SEMI", "value": ";", "line": 12, "column": 15},
{"kind": "EOF", "value": "", "line": 12, "column": 16}
]
