[
{"kind": "EXTERN", "value": "extern", "line": 1, "column": 1},
{"kind": "DEF", "value": "def", "line": 1, "column": 8},
{"kind": "IDENT", "value": "putchar", "line": 1, "column": 12},
{"kind": "LPAREN", "value": "(", "line": 1, "column": 19},
{"kind": "IDENT", "value": "x", "line": 1, "column": 20},
{"kind": "RPAREN", "value": ")", "line": 1, "column": 21},
{"kind": "SEMI", "value": ";", "line": 1, "column": 22},
{"kind": "VAR", "value": "var", "line": 2, "column": 1},
{"kind": "IDENT", "value": "a", "line": 2, "column": 5},
{"kind": "EQ", "value": "=", "line": 2, "column": 7},
{"kind": "IDENT", "value": "putchar", "line": 2, "column": 9},
{"kind": "LPAREN", "value": "(", "line": 2, "column": 16},
{"kind": "INT", "value": "72", "line": 2, "column": 17},
{"kind": "RPAREN", "value": ")", "line": 2, "column": 19},
{"kind": "SEMI", "value": ";", "line": 2, "column": 20},
{"kind": "VAR", "value": "var", "line": 3, "column": 1},
{"kind": "IDENT", "value": "b", "line": 3, "column": 5},
{"kind": "EQ", "value": "=", "line": 3, "column": 7},
{"kind": "IDENT", "value": "putchar", "line": 3, "column": 9},
{"kind": "LPAREN", "value": "(", "line": 3, "column": 16},
{"kind": "INT", "value": "105", "line": 3, "column": 17},
{"kind": "RPAREN", "value": ")", "line": 3, "column": 20},
{"kind": "SEMI", "value": ";", "line": 3, "column": 21},
{"kind": "EOF", "value": "", "line": 3, "column": 22}
]
