[
{"kind": "VAL", "value": "val", "line": 1, "column": 1},
{"kind": "IDENT", "value": "a", "line": 1, "column": 5},
{"kind": "COLON", "value": ":", "line": 1, "column": 6},
{"kind": "BOOL", "value": "Bool", "line": 1, "column": 8},
{"kind": "EQ", "value": "=", "line": 1, "column": 13},
{"kind": "TRUE", "value": "true", "line": 1, "column": 15},
{"kind": "SEMI", "value": ";", "line": 1, "column": 19},
{"kind": "VAL", "value": "val", "line": 2, "column": 1},
{"kind": "IDENT", "value": "b", "line": 2, "column": 5},
{"kind": "COLON", "value": ":", "line": 2, "column": 6},
{"kind": "BOOL", "value": "Bool", "line": 2, "column": 8},
{"kind": "EQ", "value": "=", "line": 2, "column": 13},
{"kind": "FALSE", "value": "false", "line": 2, "column": 15},
{"kind": "SEMI", "value": ";", "line": 2, "column": 20},
{"kind": "VAL", "value": "val", "line": 3, "column": 1},
{"kind": "IDENT", "value": "cmp", "line": 3, "column": 5},
{"kind": "COLON", "value": ":", "line": 3, "column": 8},
{"kind": "BOOL", "value": "Bool", "line": 3, "column": 10},
{"kind": "EQ", "value": "=", "line": 3, "column": 15},
{"kind": "INT", "value": "1", "line": 3, "column": 17},
{"kind": "EQEQ", "value": "==", "line": 3, "column": 19},
{"kind": "INT", "value": "1", "line": 3, "column": 22},
{"kind": "SEMI", "value": ";", "line": 3, "column": 23},
{"kind": "RETURN", "value": "return", "line": 4, "column": 1},
{"kind": "INT", "value": "0", "line": 4, "column": 8},
{"kind": "SEMI", "value": ";", "line": 4, "column": 9},
{"kind": "EOF", "value": "", "line": 4, "column": 10}
]
